body,category
This product is absolutely amazing and exceeded my expectations,positive
Terrible experience with customer service and the item broke immediately,negative
The item arrived on time and works as described,positive
I am very disappointed with the quality of this product,negative
Average product nothing special but not bad either,neutral
Outstanding quality and fast shipping highly recommend,positive
Worst purchase I have ever made complete waste of money,negative
It does the job but could be better for the price,neutral
Love it! Perfect for my needs and great value,positive
Do not buy this product it stopped working after one day,negative
